{
  "schema_version": 3,
  "event_id": "9f1c2e0a-4b7d-4c1e-8a52-3d6f0b9e7a14",
  "session_id": "s-6b0e2c51-0f3a-4d2b-9c7e-1a8f4e2d9b30",
  "event_type": "answer",
  "concept_tag": "addition_2digit",
  "timestamp": 1760265000123,
  "level": 2,
  "data": {
    "is_correct": false,
    "time_taken_ms": 4500,
    "attempt_number": 2,
    "error_type": "conceptual",
    "hint_used": false,
    "question_id": "q7",
    "given": "35",
    "expected": "53"
  }
}
